{
  "$schema": "http://json-schema.org/draft-07/schema#",
  "$id": "quicksite-workflow-schema",
  "title": "QuickSite Workflow",
  "description": "Schema for workflow files used in QuickSite admin panel (AI-assisted or manual)",
  "type": "object",
  "required": ["id", "version", "meta"],
  "properties": {
    "$schema": {
      "type": "string",
      "description": "Reference to this schema"
    },
    "id": {
      "type": "string",
      "pattern": "^[a-z][a-z0-9-]*$",
      "description": "Unique identifier for the workflow (kebab-case)"
    },
    "version": {
      "type": "string",
      "pattern": "^\\d+\\.\\d+\\.\\d+$",
      "description": "Semantic version of this workflow"
    },
    "meta": {
      "type": "object",
      "required": ["icon", "category"],
      "properties": {
        "icon": {
          "type": "string",
          "description": "Emoji icon for display"
        },
        "titleKey": {
          "type": "string",
          "description": "Translation key for the workflow title (core workflows)"
        },
        "name": {
          "type": "string",
          "description": "Direct display name (custom workflows without i18n)"
        },
        "descriptionKey": {
          "type": "string",
          "description": "Translation key for the workflow description (core workflows)"
        },
        "description": {
          "type": "string",
          "description": "Direct description text (custom workflows without i18n)"
        },
        "category": {
          "type": "string",
          "enum": ["creation", "modification", "content", "style", "advanced", "wip", "template"],
          "description": "Category for organizing workflows"
        },
        "tags": {
          "type": "array",
          "items": { "type": "string" },
          "description": "Tags for filtering and search"
        },
        "difficulty": {
          "type": "string",
          "enum": ["beginner", "intermediate", "advanced"],
          "description": "Complexity level for user guidance"
        },
        "suppressPinsHeader": {
          "type": "boolean",
          "description": "When true, skip the auto-injected ## Pins / ## Warnings prefix even if pins/warnings are declared. Rare; for ultra-tight prompts that lay out their own header."
        }
      },
      "anyOf": [
        { "required": ["titleKey"] },
        { "required": ["name"] }
      ]
    },
    "staticData": {
      "type": "object",
      "description": "Static data available in steps via forEach or template placeholders. Keys become data paths (e.g., 'assets' is referenced as forEach: 'assets').",
      "additionalProperties": true
    },
    "preWorkflows": {
      "type": "array",
      "description": "Workflows to run BEFORE this workflow's steps. Each can optionally specify params and a condition.",
      "items": {
        "oneOf": [
          {
            "type": "string",
            "description": "Workflow ID to run with default params"
          },
          {
            "type": "object",
            "required": ["id"],
            "properties": {
              "id": {
                "type": "string",
                "description": "Workflow ID to run"
              },
              "params": {
                "type": "object",
                "description": "Parameters to pass to the sub-workflow. Can use {{param.x}} to forward values.",
                "additionalProperties": true
              },
              "condition": {
                "type": "string",
                "description": "Condition to evaluate. Sub-workflow is skipped if false. Supports param.x, data.x, operators."
              }
            }
          }
        ]
      }
    },
    "postWorkflows": {
      "type": "array",
      "description": "Workflows to run AFTER this workflow's steps complete. Same format as preWorkflows.",
      "items": {
        "oneOf": [
          {
            "type": "string",
            "description": "Workflow ID to run with default params"
          },
          {
            "type": "object",
            "required": ["id"],
            "properties": {
              "id": {
                "type": "string",
                "description": "Workflow ID to run"
              },
              "params": {
                "type": "object",
                "description": "Parameters to pass to the sub-workflow. Can use {{param.x}} to forward values.",
                "additionalProperties": true
              },
              "condition": {
                "type": "string",
                "description": "Condition to evaluate. Sub-workflow is skipped if false. Supports param.x, data.x, operators."
              }
            }
          }
        ]
      }
    },
    "parameters": {
      "type": "array",
      "description": "User-configurable parameters shown in the UI",
      "items": {
        "type": "object",
        "required": ["id", "type"],
        "if": {
          "not": { "properties": { "type": { "const": "hidden" } } }
        },
        "then": {
          "anyOf": [
            { "required": ["labelKey"] },
            { "required": ["label"] }
          ]
        },
        "properties": {
          "id": {
            "type": "string",
            "description": "Parameter identifier"
          },
          "type": {
            "type": "string",
            "enum": ["text", "textarea", "select", "tag-select", "checkbox", "number", "nodeSelector", "selector", "hidden"],
            "description": "Input type for the parameter. `selector` auto-fills from the editor's current iframe selection — a read-only card showing tag/classes/struct/node. Workflow steps reference fields via {{param.X.tag}} etc."
          },
          "labelKey": {
            "type": "string",
            "description": "Translation key for the label"
          },
          "placeholderKey": {
            "type": "string",
            "description": "Translation key for placeholder text"
          },
          "helpKey": {
            "type": "string",
            "description": "Translation key for help text"
          },
          "required": {
            "type": "boolean",
            "default": false
          },
          "default": {
            "description": "Default value for the parameter"
          },
          "label": {
            "type": "string",
            "description": "Direct display label (custom workflows without i18n). Alternative to labelKey."
          },
          "options": {
            "type": "array",
            "description": "Static options for select type. Each item has a value and either label (direct text) or labelKey (translation key).",
            "items": {
              "type": "object",
              "required": ["value"],
              "properties": {
                "value": { "type": "string" },
                "label": { "type": "string", "description": "Direct display label" },
                "labelKey": { "type": "string", "description": "Translation key for the label" }
              }
            }
          },
          "optionsFrom": {
            "description": "Dynamic options populated from dataRequirements at render time.",
            "oneOf": [
              {
                "type": "string",
                "description": "dataRequirements ID — simple array items become both value and label"
              },
              {
                "type": "object",
                "required": ["data"],
                "properties": {
                  "data": { "type": "string", "description": "dataRequirements ID to pull options from" },
                  "value": { "type": "string", "description": "Field name to use as option value" },
                  "label": { "type": "string", "description": "Field name to use as option label" },
                  "prepend": {
                    "type": "array",
                    "description": "Options to add before dynamic ones (e.g., a 'None' option)",
                    "items": {
                      "type": "object",
                      "properties": {
                        "value": { "type": "string" },
                        "label": { "type": "string" }
                      }
                    }
                  },
                  "filterFrom": {
                    "type": "string",
                    "description": "Another parameter ID whose current value(s) restrict the available options. The filter only applies when the referenced param is currently visible (its own `condition` evaluates truthy) AND its value is non-empty. Otherwise the full optionsFrom list is used. Useful for cascading selects (e.g. 'defaultLanguage' restricted to languages picked in the multi-select 'languages')."
                  }
                }
              }
            ]
          },
          "validation": {
            "type": "object",
            "properties": {
              "minLength": { "type": "integer", "description": "Minimum character count for text/textarea params" },
              "maxLength": { "type": "integer", "description": "Maximum character count for text/textarea params" },
              "pattern": { "type": "string", "description": "Regex (JS) the value must match (text params)" },
              "min": { "type": "number", "description": "Minimum value for number params" },
              "max": { "type": "number", "description": "Maximum value for number params" },
              "minItems": { "type": "integer", "description": "Minimum number of selected items for tag-select params. Validation is skipped when the param's own `condition` evaluates false (param is hidden)." },
              "maxItems": { "type": "integer", "description": "Maximum number of selected items for tag-select params. Same conditional-skip rule as minItems." }
            }
          },
          "condition": {
            "type": "string",
            "description": "Conditional expression to show/hide this parameter. Supports: ==, ===, !=, !==, >, <, >=, <=, &&, ||, ! (negation), and truthy checks. Example: 'multilingual === true', 'pages > 1 && multilingual !== false'"
          },
          "structures": {
            "type": "array",
            "items": {
              "type": "string",
              "enum": ["page", "menu", "footer", "component"]
            },
            "description": "For nodeSelector type: which structure types to show for node selection"
          },
          "allowTextHint": {
            "type": "boolean",
            "description": "For nodeSelector type: allow user to type a text hint instead of selecting a node"
          },
          "optional": {
            "type": "boolean",
            "description": "Whether this parameter can be left empty"
          }
        }
      }
    },
    "dataRequirements": {
      "type": "array",
      "description": "List of data needed from the system via CommandRunner",
      "items": {
        "type": "object",
        "required": ["id", "command"],
        "properties": {
          "id": {
            "type": "string",
            "description": "Identifier used in prompt template"
          },
          "command": {
            "type": "string",
            "description": "Command name from CommandRunner whitelist"
          },
          "params": {
            "type": "object",
            "description": "Parameters to pass to the command"
          },
          "urlParams": {
            "type": "array",
            "items": { "type": "string" },
            "description": "URL parameters for the command"
          },
          "extract": {
            "type": "string",
            "description": "Dot-notation path to extract specific data (e.g., 'data.languages')"
          },
          "condition": {
            "type": "string",
            "description": "Parameter ID or expression. Data is only fetched when this evaluates to truthy. Example: 'targetPage' or 'multilingual === true'"
          }
        }
      }
    },
    "relatedCommands": {
      "type": "array",
      "items": { "type": "string" },
      "description": "API commands that will be used in the generated output"
    },
    "pins": {
      "type": "array",
      "items": { "type": "string" },
      "description": "Optional reusable 'pin' block IDs auto-injected at the top of the rendered prompt as a ## Pins section. Each ID resolves to secure/admin/workflows/pins/{id}.md. Use for component / structural reminders that the AI must follow (e.g. 'lang-switch')."
    },
    "warnings": {
      "type": "array",
      "items": { "type": "string" },
      "description": "Optional reusable 'warning' block IDs auto-injected at the top of the rendered prompt as a ## Warnings section. Each ID resolves to secure/admin/workflows/warnings/{id}.md. Use for output-format constraints (e.g. 'json-only')."
    },
    "promptTemplate": {
      "type": "string",
      "description": "Filename of the .md prompt template (same folder as spec)"
    },
    "steps": {
      "type": "array",
      "description": "For manual workflows: commands to execute directly (no AI). Presence of steps without promptTemplate makes this a manual workflow.",
      "items": {
        "$ref": "#/definitions/specCommand"
      }
    }
  },
  "definitions": {
    "specCommand": {
      "type": "object",
      "description": "A command or template to execute automatically",
      "properties": {
        "comment": {
          "type": "string",
          "description": "Optional comment for documentation/debugging purposes. Ignored during execution."
        },
        "condition": {
          "type": "string",
          "description": "Condition expression. Supports: param.X === value, config.MULTILINGUAL_SUPPORT === true, data.X for dataRequirements. Also supports && and || operators."
        },
        "forEach": {
          "type": "string",
          "description": "Data path to iterate over (e.g., 'routes', 'assets', 'langData.languages'). Generates one command per item. Use {{$key}} and {{$value}} in params."
        },
        "filter": {
          "type": "string",
          "description": "Filter expression for forEach items. Supports {{$key}}, {{$value}}, {{$value.prop}}, and {{dataPath}} references. Items where filter evaluates to false are skipped."
        },
        "template": {
          "type": "string",
          "description": "Name of a batch template to execute (mutually exclusive with command)"
        },
        "command": {
          "type": "string",
          "description": "API command name to execute (mutually exclusive with template)"
        },
        "method": {
          "type": "string",
          "enum": ["GET", "POST", "PUT", "PATCH", "DELETE"],
          "description": "HTTP method to use for the command. Default: POST for workflow steps.",
          "default": "POST"
        },
        "params": {
          "type": "object",
          "description": "Parameters for the command. Supports {{config.X}}, {{param.X}}, {{dataRequirementId.path}}, and in forEach: {{$key}}, {{$value}}, {{$value.field}}",
          "additionalProperties": true
        },
        "abortOnFail": {
          "type": "boolean",
          "description": "If true, abort the entire workflow if this command fails",
          "default": false
        },
        "retryOn": {
          "type": "array",
          "items": { "type": "integer" },
          "description": "HTTP status codes that should trigger an automatic retry (e.g., [409, 503]). Only retries when the response status matches one of these codes."
        },
        "maxRetries": {
          "type": "integer",
          "minimum": 1,
          "maximum": 10,
          "default": 3,
          "description": "Maximum number of retry attempts when retryOn matches. Default: 3."
        },
        "retryDelayMs": {
          "type": "integer",
          "minimum": 100,
          "maximum": 30000,
          "default": 1000,
          "description": "Delay in milliseconds between retry attempts. Default: 1000ms."
        }
      },
      "oneOf": [
        { "required": ["template"] },
        { "required": ["command", "params"] }
      ]
    },
    "eachLoop": {
      "type": "object",
      "description": "Loop construct for generating arrays from config data",
      "properties": {
        "$each": {
          "type": "string",
          "description": "Source to iterate over, e.g., {{config.LANGUAGES_NAME}}"
        },
        "$item": {
          "type": "object",
          "description": "Template for each item. Use {{$key}} and {{$value}} for placeholders"
        }
      },
      "required": ["$each", "$item"]
    }
  }
}
